,Title,Date,Link,Journal,Subtitle,data
24,“정읍발 AI 道 경계선부터 차단하라”,01.Dec.20,http://www.kwangju.co.kr/news_view.php?aid=1606818000709583004,광주일보,"김영록 지사, 대비책 긴급 지시",김영록 전남지사는 1일 정읍발 고병원성 AI(조류인플루엔자) 도내 차단을 위한 방역망 구축 등 경각심을 갖고 철저한 대비책을 마련하라고 긴급 지시했다.김 지사는 이날 도청 서재필에서 열린 실국장 정책회의를 통해 “정읍발 고병원성 AI는 전남으로선 전북과의 교류로 중요한 지점이다”며 “특히 도내에 계열사가 많아 도축금지와 차단방역 등 경계선부터 특단의 대책을 세워 피해예방에 나서야 한다”고 이같이 주문했다.김 지사는 또 “전남은 코로나19와 관련해 1.5단계 거리두기에 들어갔지만 음식물 섭취로 인한 위험요인이 상존하고 있다”며 “1.5단계부터 음식섭취가 금지된 노래연습장처럼 영화관이나 멀티방도 음식물로 인한 피해가 없도록 강력히 권고하는 등 생활속 다중이용시설에 대한 관리도 병행해야 한다”고 덧붙였다.특히 “수능시험을 앞두고 도차원에서 큰 관심을 갖고 적극 지원해야 한다”고 말하고 “수험생들의 확진자와 자가격리자들의 시험에 차질 없도록 철저히 준비하고 만일의 사태발생시 최우선으로 진담검사와 결과를 도출할 수 있도록 만전을 기해달라”고 당부했다.최근 정부에 건의한 SOC사업과 관련해 김 지사는 “그동안 소외됐던 각종 전남의 현안들이 현 정부들어 호남고속철도 무안공항 경유와 남해안 철도 전철화 사업 등 굵직굵직한 사업들이 해결되는 성과를 보였다”며 “정부는 국가철도망 계획에 전라선 고속철도에 대해 긍정적으로 검토하고 있지만 앞으로 최선을 다해 국가계획에 반영될 수 있도록 노력해 달라”고 언급했다.이어 “그동안 전남에서 추진중인 국가첨단의료복합단지 구축은 연말이면 지정 신청하게 된다”며 “이런 부분은 바이오 산업에 새로운 전기를 마련해줄 수 있어 특히 화순은 감염병과 백신면역치료제 생산 거점으로 장성 국립심혈관센터와 완도 해양치유 거점 등과 연계하면 승산이 있다”고 말하고 국회의원과 함께 반드시 성사될 수 있도록 하자”고 말했다.  /윤현석 기자 chadol@kwangju.co.kr
25,“정읍발 AI 道 경계선부터 차단하라”,01.Dec.20,http://www.kwangju.co.kr/news_view.php?aid=1606818000709583004,광주일보,"김영록 지사, 대비책 긴급 지시",김영록 전남지사는 1일 정읍발 고병원성 AI(조류인플루엔자) 도내 차단을 위한 방역망 구축 등 경각심을 갖고 철저한 대비책을 마련하라고 긴급 지시했다.김 지사는 이날 도청 서재필에서 열린 실국장 정책회의를 통해 “정읍발 고병원성 AI는 전남으로선 전북과의 교류로 중요한 지점이다”며 “특히 도내에 계열사가 많아 도축금지와 차단방역 등 경계선부터 특단의 대책을 세워 피해예방에 나서야 한다”고 이같이 주문했다.김 지사는 또 “전남은 코로나19와 관련해 1.5단계 거리두기에 들어갔지만 음식물 섭취로 인한 위험요인이 상존하고 있다”며 “1.5단계부터 음식섭취가 금지된 노래연습장처럼 영화관이나 멀티방도 음식물로 인한 피해가 없도록 강력히 권고하는 등 생활속 다중이용시설에 대한 관리도 병행해야 한다”고 덧붙였다.특히 “수능시험을 앞두고 도차원에서 큰 관심을 갖고 적극 지원해야 한다”고 말하고 “수험생들의 확진자와 자가격리자들의 시험에 차질 없도록 철저히 준비하고 만일의 사태발생시 최우선으로 진담검사와 결과를 도출할 수 있도록 만전을 기해달라”고 당부했다.최근 정부에 건의한 SOC사업과 관련해 김 지사는 “그동안 소외됐던 각종 전남의 현안들이 현 정부들어 호남고속철도 무안공항 경유와 남해안 철도 전철화 사업 등 굵직굵직한 사업들이 해결되는 성과를 보였다”며 “정부는 국가철도망 계획에 전라선 고속철도에 대해 긍정적으로 검토하고 있지만 앞으로 최선을 다해 국가계획에 반영될 수 있도록 노력해 달라”고 언급했다.이어 “그동안 전남에서 추진중인 국가첨단의료복합단지 구축은 연말이면 지정 신청하게 된다”며 “이런 부분은 바이오 산업에 새로운 전기를 마련해줄 수 있어 특히 화순은 감염병과 백신면역치료제 생산 거점으로 장성 국립심혈관센터와 완도 해양치유 거점 등과 연계하면 승산이 있다”고 말하고 국회의원과 함께 반드시 성사될 수 있도록 하자”고 말했다.  /윤현석 기자 chadol@kwangju.co.kr
26,"[사진뉴스] 광주여자대학교, 제11회 언어치료학과 언어재활사 선서식 개최",01.Dec.20,http://www.kwangju.co.kr/news_view.php?aid=1606809785709542021,광주일보,,광주여자대학교(총장 이선재) 언어치료학과는 정보통신관 4층 세미나실에서 ‘제11회 언어치료학과 언어재활사 선서식’을 개최했다고 1일 밝혔다. 이번 선서식은 코로나 19 상황임을 감안하여 선·후배들의 축하 등 행사를 다소 축소해 진행하였다.
27,시험장 책상 가림막을 두고 대응책 마련에 분주,01.Dec.20,http://www.kwangju.co.kr/news_view.php?aid=1606801655709537006,광주일보,,"수험생들이 방역을 위해 올해 수능에 첫 도입된 시험장 책상 가림막을 두고 대응책 마련에 분주해졌다. 달라진 시험장 환경에 일부 수험생들은 가림막을 직접 구매해 미리 체험해보고 있는 실정이다. 교육부에 따르면 전면 가림막 크기는 가로 60㎝, 높이 45㎝다. 책상 상단 양쪽 모서리에는 가림막을 고정할 바닥판이 부착된다. 바닥판 크기는 가로 10㎝, 세로 9.5㎝다. 수험생들은 가림막 설치로 수능 응시에 불편함이 커졌다고 입을 모은다. 시험지만 해도 8절지(272×394㎜) 크기로 책상을 가득 채운다. 수험표와 필통 등을 올려둘 공간을 고려하면, 몸을 움직일 공간이 좁아 갑갑한 상태라는 것이다. 특히 국어·영어영역에서는 지문이 길게 나올 경우 시험지 전체를 펼쳐놓고 양면을 동시에 봐야 하는데 칸막이가 걸릴 수 있다는 지적도 나온다. 교육부는 코로나19 감염 예방을 위해 불가피한 조처라는 입장이다. 교육부는 최대한 수험생에게 방해가 되지 않도록 크기나 시험지를 넘기는 것 등을 고려해 가림막을 준비했다고 설명했다. 이와 관련 일각에서는 가림막이 오히려 수능 응시에 도움이 될 것 같다는 의견도 나온다.  한 수험생은 온라인 커뮤니티에 “앞 사람이 잘 보이지 않아 시험에만 집중할 수 있고, 정작 불편함은 적었다”라고 밝혔다. 상황이 이렇게 되자 수험생이 모인 온라인 커뮤니티에서는 사전에 가림막을 구매해 사용해 본 후기를 나누는 글도 어렵지 않게 찾을 수 있다. 유튜브에서도 가림막 사용 후기 영상이 인기다. 실제로 광주시교육청은 수능 시험장 가림막 책상 영상을 제작, 자체 유튜브에 게시했다. 수험생들의 막연한 불안감을 해소하는 한편 사전 공개를 통해 낯선 시험 환경에 대한 적응력을 높여주기 위함이다.  입시 전문가들은 가능할 경우 가림막을 구해서 직접 체험해보라고 조언했다. 다만, 직접 칸막이 구매가 어려우면 수능 당일 20~30분 일찍 고사실로 가서 칸막이에 적응하는 방법도 있다. 수능 시험 당일은 오전 6시30분부터 시험장 출입이 가능하다./김대성 기자 bigkim@kwangju.co.kr"
28,"한전, 수능 앞두고 1352개 시험장 전력점검",01.Dec.20,http://www.kwangju.co.kr/news_view.php?aid=1606787956709533005,광주일보,내년 2월까지 ‘동계 안정적 전력공급’,"한국전력(대표이사 사장 김종갑)은 1일부터 내년 2월28일까지를 ‘동계 안정적 전력공급 대책 추진기간’으로 지정·운영한다고 밝혔다. 한전은 코로나19 비상상황에 대응하고 겨울철 전력을 안정적으로 공급하기 위해 특별 전력설비 운영대책을 수립했다. 앞서 지난 달 25일 한전은 질병관리청 전력공급설비에 대한 특별점검을 추진했다. 1일부터 국민안심병원, 선별진료소 등 코로나19 대응기관 전력공급설비에 대한 특별점검 및 보강을 시행한다. 또 겨울철 정전피해 예방을 위해 전력구 일제점검과 다중이용시설 변압기 등에 대한 점검·보강을 지속적으로 벌일 방침이다. 지난 달 10일부터는 2021학년도 대학수학능력시험장 무결점 전력공급을 위해 시험장 전력공급설비에 대한 점검을 시행해왔다. 점검 대상은 86개 시험지구 1352개 시험장이다./백희준 기자 bhj@kwangju.co.kr"
29,24년 타이거즈맨 장세홍 코치 “류현진 승승장구 돕겠습니다”,01.Dec.20,http://www.kwangju.co.kr/news_view.php?aid=1606827600709621028,광주일보,"[류현진 전담 트레이너로 새출발 장세홍 전 KIA 코치]
1997년 해태 타이거즈 입사…선수들 부상 관리·회복 크게 기여
류현진 측근 추천으로 성사…“메이저리그 시스템 배울 좋은 기회”","타이거즈에서 23년을 활동한 ‘베테랑 트레이너’ 장세홍 코치가 류현진(토론토 블루제이스)의 전담 트레이너로 새로운 도전에 나선다. 류현진은 지난 2019시즌부터 개인 전담 트레이닝 코치를 통해 전력 극대화를 꾀했다. 김용일 현 LG 트윈스 코치가 2019년 류현진과 호흡을 맞췄고, 올 시즌에는 김병곤 키움 히어로즈 단장 특별보좌와 함께 시즌을 보냈다. 그리고 장 코치가 세 번째 조력자가 돼 ‘코리아 몬스터’의 토론토 도전기를 함께 하게 된다. 사실 두 사람은 ‘남’이다. 장 코치는 “(류현진이) 캐나다에서 들어오기 전에 연락을 받았다. 연락을 받고 놀랐다. 개인적으로 본 적이 없고, 대표팀에서의 인연 그런 것도 없다. 그래서 내가 반대로 어떻게 연락을 하게 됐냐고 묻기도 했다”고 웃었다. 장 코치는 1997년 해태 타이거즈에 입사해 24년 동안 한 팀에서 활동을 해왔다. 부상 선수들, 특히 투수들 관리에서 좋은 평가를 받았고, 류현진은 주변의 추천으로 장 코치를 선택했다. 장 코치는 “많이 고민이 되기는 했다. 지금까지의 생활이 안정적이기도 했지만 팀 소속으로 한계점도 있고, 개인적으로도 변화가 필요했다”며 “좋은 기회라고 생각했다”고 새 도전에 관해 이야기했다. 기대 반 걱정 반의 도전이다. 장 코치는 “(류현진을) 직접 만나보니 피지컬적인 부분도 좋고 장점이 많다. 월드 클래스 선수는 어떨까 궁금하기도 했는데 습득력도 좋다”며 “왼쪽 어깨와 내전근, 왼쪽 골반 등에서 그동안 선수 생활을 하면서 생긴 흔적들이 보였다. 안 쓰려 했던 부분도 보이고, 교정해 나가면 충분히 더 좋아질 수 있을 것 같다”고 이야기했다. 이어 “지금까지 류현진 선수가 최고의 활약을 해왔기 때문에 그걸 유지해야 하는 게 부담이 되기는 한다”며 “3년을 보고 간다. 개인적으로 구단 소속으로 활약할 수 있게 돼서 메이저리그의 전체적인 운영 시스템을 볼 수 있을 것 같다. 좋은 기회로 삼겠다”고 말했다. 장 코치와 류현진은 12월 실내에서 체력·근력 훈련에 전념한 뒤 1월부터는 본격적인 시즌을 준비할 계획이다. 류현진은 매년 캠프 합류에 앞서 따뜻한 일본 오키나와에서 워밍업을 했었지만, 이번에는 코로나 19로 변화가 불가피할 전망이다. 장 코치는 “오키나와에서 운동을 해왔는데 올해는 코로나 때문에 쉽지 않을 것 같다”며 “무조건 도움이 될 수 있도록 많이 준비하고 노력하겠다. 좋았던 것 유지하고 경기력에 더 도움이 될 수 있도록 최선을 다하겠다”고 말했다.  /김여울 기자 wool@kwangju.co.kr"
30,"전남도 일자리 우수기업 20개 선정, 코로나 딛고…고용창출로 사회 기여",01.Dec.20,http://www.kwangju.co.kr/news_view.php?aid=1606815900709552004,광주일보,,"전남도는 코로나19로 인한 어려운 여건속에서도 일자리창출과 고용안정에 기여한 올해 일자리 우수기업 20개를 선정했다.선정된 14개 시·군 20개 기업은 목포 (유)송원이엔지·(주)제이케이중공업, 여수 (주)승진엔지니어링, 순천 (주)두원산업·(주)삼미메탈, 나주 (주)우둥·세라코(주), 광양 쿠로엔시스·(주)일성산업·중앙이엠씨(주), 곡성 (주)금성이앤씨, 구례 (주)쿱농산, 고흥 바이오코프(주)·(유)푸드원, 보성 보성포리테크(주), 장흥 (주)제이엔피, 강진 (주)로우카본, 해남 원광전력(주), 장성 (주)한사랑에프에스, 완도 누리영어조합법인 등이다.특히 나주 (주)우둥 기업은 섬유질 배합사료 등을 생산중인 기업으로 지난 2015년 설립 이후 45명의 지역일자리를 창출했다. 올해 코로나19에 따른 고용한파에도 불구하고 최근 1년간 18명을 정규직으로 채용하기도 했다. 나주시 사랑의 열매 착한기업에 선정되는 등 지역사회에 기여해왔으며, 직원 본인 및 자녀학자금 지원 등 근로 복지 향상에도 앞장서고 있다.선정된 기업은 2000만원의 고용환경개선비용을 지원받게 되며, 12월중 개최예정인 전라남도 일자리·투자유치 한마당에서 인증서와 인증패도 수여된다. 인증기간은 내년 1월부터 2년간이다. 이밖에 전남도 중소기업육성기금 융자한도 우대를 비롯 청년 근속장려금 가산점 지원, 지방세 세무조사 3년 면제 등의 혜택도 받을 수 있다. 올해 일자리 우수기업 인증사업에는 도내 34개 기업이 신청했으며, 서류 및 현장평가, 일자리정책 심의위를 거쳐 20개 기업이 최종 선정됐다. 서류 및 현장평가는 공정성과 객관성을 확보하기 위해 광주전남연구원 일자리평가분석센터에 의뢰해 추진했다.  /윤현석 기자 chadol@kwangju.co.kr"
