,Title,Date,Link,Journal,Subtitle,data
7,영어는 작년보다 평이…수학 가형은 고난도,01.Dec.20,https://news.imaeil.com/Society/2020120118112300770,매일신문,국어는 최근 출제 경향 유지||영어 新유형 없어 1등급 많아질 듯||14일 정답 발표…성적은 23일 통지,"코로나19 확산 속에서 3일 전국 86개 시험지구 1천241개 시험장에서 치러진 2021학년도 대학수학능력시험은 대체로 평이한 수준이었다는 평가가 나오고 있다. 지난해 수능시험보다 수학 가형이 다소 어려웠을 뿐, 대체로 좀 더 쉬웠다는 분석이다.   입시업체들은 매 교시 시험이 끝난 뒤 한국교육과정평가원이 공개하는 문제지와 정답을 분석해 예상 난이도를 발표했다. 이들은 국어와 영어, 수학 나형이 지난해 수능시험과 비슷하거나 좀 더 쉬웠다고 입을 모았다.   국어는 지난해 수능시험과 난이도가 비슷하거나 다소 쉬웠다는 평가가 대부분이다. 화법, 작문 영역의 난이도는 평이했고 언어, 문학, 독서 영역 등도 최근의 출제 경향이 유지돼 그리 까다롭지 않았다. 하지만 수험생 사이에선 꽤 어려웠다는 얘기도 나오고 있다.   차상로 송원학원 진학실장은 ""대체로 교과서에 제시된 주요 개념이나 원리, 학습 활동 내용 등을 중심으로 학습했으면 풀 수 있는 문제들이 출제됐다""며 ""꼼꼼히 읽고 분석해야 하는 문학 영역의 40, 41번과 독서 영역의 36번 정도가 상대적으로 어려운 문제였을 것""이라고 했다.   절대평가인 영어도 지난해 수능시험 때보다 좀 더 쉽거나 비슷한 수준으로 출제됐다. 지난해 1등급 비율이 7.43%였는데 이번에는 이 비율이 약간 높아질 수도 있다는 의미다. 새로운 유형도 등장하지 않았다.   윤일현 지성학원 진학실장은 ""유형, 배점, 문항의 배열 순서 등 출제 방식이 전과 다르지 않았다""며 ""변별력이 있는 문항을 일부 끼워 두긴 했으나 대체로 어렵지 않은 수준이었다""고 했다.   반면 수학은 가형과 나형의 난이도 수준이 달랐다. 9월 모의평가, 지난해 수능시험과 비교할 때 가형은 좀 더 어려웠으나 나형은 다소 쉬웠던 것으로 분석됐다.   이만기 유웨이 교육평가연구소장은 ""가형은 다소 까다로웠지만 나형은 그리 어렵지 않았던 것으로 보인다. 고난도 문항이 쉽게 출제됐다""며 ""다만 나머지 문항의 난도가 그리 낮지 않아 나형도 체감 난도는 높았을 수 있다""고 했다.   수능시험을 주관하는 한국교육과정평가원은 수능시험 직후부터 7일 오후 6시까지 평가원 홈페이지(www.kice.re.kr) 내 전용게시판을 통해 문제와 정답에 대한 이의 신청을 받는다. 접수한 의견에 대한 심사를 거쳐 14일 오후 5시 정답을 최종 확정, 발표한다. 수능시험 성적은 23일 통지한다."
8,"부산상수도사업본부, 비대면 모바일 수도요금 ARS 납부서비스 시행",01.Dec.20,http://www.sedaily.com/NewsView/1ZBIJH6DYZ,서울경제,스마트폰 활용 수도요금 납부서비스,"부산시상수도사업본부는 7일부터 비대면 모바일 납부방식의 ‘보이는 수도요금 ARS 납부서비스’를 17개 시·도 상수도 분야 최초로 시행한다고 1일 밝혔다.  이는 은행 CD/ATM, 편의점 등을 활용한 방문형 수도요금 납부방식을 개선한 것으로, 스마트폰만 있으면 365일 언제 어디서나 수도요금을 편리하게 낼 수 있는 서비스다.  이번 서비스를 이용하고자 하는 시민은 우선 상수도사업본부 ARS 대표번호로 전화해 음성안내에 따라 보이는 ARS 파일을 설치(서비스 이용 첫 회에만 해당)해야 한다.  이후 스마트폰에 표출되는 화면에 따라 요금 조회 및 납부, 요금 자동납부 신청 및 해지, 자가 검침 등의 항목을 이용하면 된다. 특히 신용카드와 통장계좌를 통한 수도요금 자동납부를 신청하면 수도요금의 1%(최대 5,000원)를 할인 받을 수 있다.  이근희 부산시 상수도사업본부장은 “이번에 도입하는 서비스는 신종코로나바이러스감염증(코로나19)로 인해 비대면 납부방식을 선호하는 추세를 적극 반영한 것”이라며 “안전한 환경에서 스마트폰으로 수도요금을 편리하게 낼 수 있을 뿐만 아니라 공인인증서가 필요하지 않다는 강점도 있는 만큼 시민들의 많은 관심과 이용을 당부한다”고 말했다.  모두에게 익숙한 전화를 이용한 비대면 음성형 수도요금 납부서비스는 2015년에 처음 시행된 후 매년 2배 이상 사용량이 늘고 있으며 현재는 5만 명 이상, 100억 원 이상의 요금 징수실적을 거두고 있다. 이러한 추세에 따라 상수도사업본부는 2016년에는 전국 최초로 신용카드, 통장계좌를 통한 수도요금 자동납부 서비스를 도입하고 2017년에는 금융결제원과 연동해 실시간 계좌검증 서비스를 도입하는 등 납부방식을 끊임없이 확대·보완해 나가고 있다. /부산=조원진기자 bscity@sedaily.com"
9,구미 LG디스플레이 ‘사랑의 온도탑 제막식’서 성금 3천만원 기탁,01.Dec.20,https://news.imaeil.com/Society/2020120116460519370,매일신문,"구미지역 뇌병변장애인, 발달장애인 재활·교육 프로그램비로 지원","구미국가산업단지 내 LG디스플레이㈜(대표이사 사장 정호영)는 1일 구미시청에서 열린 '희망 2021 나눔 캠페인 출범 및 사랑의 온도탑 제막식'에서 이웃돕기 성금 3천만원을 기탁했다.   이 성금은 구미 지역 뇌병변장애인을 위한 특수체육 프로그램과 발달장애인의 자립 지원을 위한 교육 프로그램 지원비 등으로 사용된다.   김상철 LG디스플레이 구미경영지원담당은 ""코로나19로 서민들의 삶이 더욱 팍팍해졌다""며 ""아동·노인·장애인 등 사회·경제적 취약계층에 희망을 나누며 함께 더불어 사는 따듯한 사회가 되길 소망한다""고 밝혔다.   한편 LG디스플레이는 2007년부터 14년째 매년 구미 지역의 소외계층을 위해 3천만원의 성금을 기탁하고 있다."
10,[신팔도명물] 고당도 얇은 껍질…안성 포도,01.Dec.20,https://news.imaeil.com/Travel/2020120117340727965,매일신문,국내 첫 포도 재배지 120년 역사||씨 없는 거봉 주력…삼색 포도 개발||철저한 수세관리 친환경 인증 받아,"비타민과 유기산이 풍부해 '과일의 여왕'이라 불리는 포도. 포도 수확철인 매년 7~9월이면 안성의 지천에는 탱글탱글한 포도가 먹음직스럽게 주렁주렁 매달려 장관을 이룬다.경기도 안성시는 예부터 전국에서 우수한 품질에 맛 좋기로 명성이 자자한 포도 명산지로 유명세를 떨치고 있다. 특히 안성시는 우리나라에서 최초로 포도가 재배된 곳으로 안성 포도의 역사는 120년 대한민국 포도의 역사와 그 궤를 같이한다.   안성시와 포도 농가들은 '안성포도'의 명성을 이어 나가기 위해 포도박물관을 건립하고 매년 안성포도축제를 개최함은 물론 재배농가의 판로개척과 품질 계량을 위한 각종 지원도 아끼지 않고 있다.   ◆대한민국 포도 최초 재배지 안성   　안성시는 우리나라 최초의 포도 재배지다. 최초 전래자는 프랑스 국적의 '앙투안 공베르(R. Antoie A.Gombert·한국명 공안국)' 신부로 지난 1901년 안성 천주교 초대 신부로 부임하면서 성당 앞뜰에 머스캣 포도나무 묘목 20여 그루를 심은 것이 대한민국 포도 역사의 시초다.   　공베르 신부는 동생인 줄리앙 공베르 신부와 함께 국내에서 50여년 동안 선교활동을 벌이다 한국전쟁 발발과 함께 두 형제 모두 납북돼 안타깝게 생을 마감했다. 안성시는 안성지역에 최초로 포도를 전래해준 공베르 신부의 공로를 높이 사 지난 2011년 '안성시를 빛낸 4인'으로 선정해 내혜홀광장에 실물 130% 크기의 청동재질 흉상을 설치했다. 공베르 신부가 안성에 포도를 전래한 이후 재배와 수확 방법 등을 습득한 안성 주민들은 꾸준히 재배면적을 늘린 결과, 한때 700㏊에서 1만여㎏에 달하는 포도를 생산해 수도권 지역 최대 생산지로 각광을 받았다.   　현재 안성지역 포도농가들은 각국과의 FTA 체결 등의 영향으로 외국에서 들어온 포도들과 경쟁력을 강화하기 위해 면적과 생산량보다 품종과 품질을 개량한 포도를 생산하는데 주력해 2018년 기준 484㏊에 4천851㎏의 포도를 생산하고 있다.   　안성지역에서 주력으로 생산되는 포도는 '씨 없는 거봉'이지만 차별화된 기술로 흑색과 청색, 적색 등 삼색포도도 생산하고 있다. 안성포도는 지난 2008년부터 국내를 넘어 싱가포르와 베트남 등 동남아에 수출돼 현지인들의 입맛을 사로잡고 있다.   ◆ 안성 5대 농특산물 중 하나인 '안성포도'   　안성포도는 쌀과 배, 한우, 인삼과 더불어 안성시 5대 농특산물로 지정돼 있다. 안성포도는 포도 고유의 색깔이 선명하고 껍질이 얇아 당도가 높고 특유의 맛과 향이 살아 있는 것이 특징으로 소비자들에게 정평이 나 있다. 이는 안성 포도 재배지역이 차령산맥 줄기인 서운산을 배경으로 알맞은 강수량과 밤낮의 일교차가 크며 양질의 토양에서 재배하기 때문이다.   거기에 정성을 다한 개별 포장으로 포도의 손상을 막아주고 철저한 당도 측정으로 고품격 품질로 오랜 시간 동안 소비자들에게 신뢰를 쌓아온 점도 한몫하고 있다. 또한 포도나무의 철저한 수세관리를 위해 착색제와 환상박피를 엄격히 제한하는 한편 국립농산물품질관리원으로부터 친환경, 저농약 재배 인증을 받은 비가림재배 포도를 공동선별 출하해 안정도도 보장하고 있다.   특히 최적의 자연환경 속에서 재배한 포도를 수확과 배송 전 과정에 걸쳐 철저한 품질관리 체계를 구축하고 있어 어느 지역에서 생산되는 포도보다 명품임을 자랑한다. 이 밖에도 120년이 넘게 대대손손 안성지역에서 포도를 재배해 온 포도농가들로 구성된 '포도연구회'는 1년에 10회 이상 한자리에 모여 포도 재배에 대한 정보와 기술을 공유해 더 나은 품질의 우수한 포도 생산에 큰 기여를 하고 있다.   　포도농가들은 ""우리는 매번 회의 때마다 기존의 품종에 대한 품질을 향상을 위해 대대로 내려온 재배기술 비법에 현대 과학이 가미된 신기술을 접목시키는 연구를 꾸준히 이어 나가고 있다""며 ""현실에 안주하지 않는 노력이 뒷받침됐기에 안성포도가 특별하고 명품임을 자랑스럽게 말할 수 있다""고 밝혔다.   ◆안성포도축제와 안성포도박물관   　안성시는 안성포도의 우수성을 대내외에 알리고 지역 농가들의 판로 개척 등을 위해 포도 수확철 중 가장 맛이 좋다는 매년 9월에 안성시 서운면 일원에서 '안성포도축제'를 개최해오고 있다. 축제 개최지인 서운면은 안성지역 포도 1년 생산량 중 65% 이상을 이곳에서 재배하기에 명품 포도를 생산하는 메카 중의 메카로 손꼽힌다. 특히 2000년대 초·중반에는 포도재배면적이 700㏊를 넘어 마을 자체가 하나의 거대한 포도밭인 적도 있었다.   　안성포도축제에서는 매년 전야제를 시작으로 포도시식과 시음, 포도 와인 만들기 체험, 포도품종 전시, 포도 빨리먹기 대회 등 포도를 주제로 한 다채로운 행사로 진행돼 수도권을 넘어 전국 각지에서 수 많은 인파가 몰려 성황을 이룬다.   다만 올해는 코로나19 감염병 사태로 인해 드라이브 스루 형식으로 포도판매와 판촉행사를 축소해 열었으나 지역을 대표하는 전통 축제답게 수많은 관광객들이 차량을 이용해 안성포도를 구매해 사전에 준비한 포도들이 축제기간이 끝나기도 전에 동이나는 현상까지 빚어지기도 했다.   실제로 포도축제위원회가 최근 개최한 자체평가회에서 드라이브 스루 형식으로 진행된 축제에는 3천500여대의 차량이 방문해 포도 1만200박스가 판매돼 2억6천520만원의 매출액을 올린 것으로 집계됐다.   　   안성에는 이런 안성포도의 역사를 한곳에 집대성한 국내 최초 포도박물관인 샤토안이 있다. 지난 2010년에 개관한 박물관 샤토안은 내부에는 수장고와 전시실을 비롯 와인시음장, 와인판매장, 레스토랑 등의 시설을 갖추고 있으며 외부에는 캠핑장과 각종 체험행사를 할 수 있는 포도밭이 있다. 이 곳에서는 포도를 매개체로 한 와인과 포도즙, 포도과자 등 각종 가공식품도 판매하고 있다. 특히 안성에서 재배된 거봉으로 만든 꼼베 와인은 이 곳에서 판매하는 가공식품 중 소비자들에게 가장 각광받는 제품이다. 꼼베는 포도를 대한민국 안성에 전래해준 꽁베르 신부와 축제를 일컫는 페스티벌을 합쳐 만든 상표 이름이다. 하지만 현재 포도박물관은 운영상의 문제로 잠시 휴관 중이다.   한국지방신문협회 경인일보 민웅기기자 muk@kyeongin.com"
11,"경북신용보증재단, 3년간 눈부신 성장…지역경제 동반자",01.Dec.20,https://news.imaeil.com/Society/2020120112402131707,매일신문,코로나 피해기업 특례보증 전국 1위||보증 공급 올 10월 기준 7만여건…보증 잔액·출연금 3년전比 3배로,"경북신용보증재단(이사장 박진우·이하 경북신보)이 괄목상대할 성장을 이뤄냈다.   최근 3년간 급속 성장을 하며 보증 공급액, 보증 잔액, 출연금 등이 폭발적인 증가세를 보이고 있다. 20년 전 재단 설립 당시와 비교해 보증 공급액은 무려 270배, 보증 재원으로 활용되는 출연금은 30배나 증가했다.   특히 코로나19에 대응한 경북신보의 역할은 더욱 빛이 났다. 코로나19 피해를 입은 소상공인들의 대출 신청이 폭증, 구미 본점을 비롯한 경북도 내 시·군 지점은 전쟁터를 방불케 할 정도였다. 하지만 전 직원들이 도시락을 2개씩 싸들고 다니며 새벽까지 일하는 등 몸을 아끼지 않으면서 하루 평균 100건이던 심사 건수를 2천건까지 처리, 놀라운 대처 능력을 발휘했다.   특히 코로나19 피해기업 특례보증 실적은 재단 직원 수가 7, 8배에 달하는 서울·경기도를 제치고 전국 시·도별 1위를 기록하며 가장 모범적인 재단으로 자리매김했다.   ◆경북신보의 주요 실적   보증 공급 건수 및 금액은 2017년 2만4천333건(5천279억원), 2018년 2만5천873건(5천491억원), 2019년 3만951건(7천47억원), 올들어 지난 10월까지는 7만5천514건(1조8천412억원)으로 급증했다.   보증 잔액 역시 2017년 5만9천148건(9천915억원), 2018년 6만3천692건(1조520억원), 2019년 7만3천506건(1조2천978억원), 올들어 10월까지 12만4천289건(2조6천163억원)으로 늘었다.   출연금은 2017년 105억원, 2018년 137억원, 2019년 215억원, 올해는 356억원으로 최근 3년간 세 배 이상을 확보했다.   이런 급속 성장으로 경북신보는 20년 전 재단 설립 당시와 비교해 연간 보증 공급액은 66억원에서 1조8천412억원으로 무려 270배, 출연금은 2천674억원으로 30배나 각각 증가했다.   중소벤처기업부가 시행한 전국 16개 시도별 지역신용보증재단 보증사업 평가 순위에서 경북신보는 2018년 12위, 2019년 6위, 올해는 3위로 가파르게 상승했다.   ◆코로나19에 더욱 빛난 경북신보의 역할   지난 3월 코로나19 확산으로 직격탄을 맞은 소상공인들의 자금 신청이 폭증하면서 구미 임수동의 본점을 비롯해 경북도 내 10개 시·군 지점은 대출을 받기 위한 소상공인들로 장사진을 이뤘다. 돈 가뭄이 그만큼 절박했다는 얘기다.   끊임없이 찾아오는 민원인들로 대출 신청 및 심사가 지체되자 경북신보는 비상경영체제를 선포, 인력 확보에 나서는 한편 신속심사팀 운영으로 총력 대응에 나섰다.   금융회사와 시·군은 물론 육군 50사단 군 병력 23명까지 지원 받았다. 부족한 공간 확보를 위해 사무 공간을 긴급 임차하고, 구미·칠곡 등 인근 시·군으로부터 PC·책상 등 사무실 집기를 조달했다.   또 필수 인력을 제외한 모든 직원을 일선 영업점과 신속심사팀으로 파견했다. 직원 중 가장 높은 직급인 본부장급은 물론 이사장도 예외가 아니었다. 본부장들은 영업점에서 대출 업무를, 이사장은 서류를 실어 날랐다.   직원들은 코로나19에 취약한 환경 속에서 업무처리 시간을 아끼기 위해 도시락으로 점심과 저녁을 해결했고, 매일 새벽까지 일하기 일쑤였다. 주말 근무도 일상이 되었다.   이에 하루 평균 100건이던 심사 건수는 무려 2천건까지 처리됐고, 대출을 받기까지 2개월 이상 걸리던 것이 2주로 단축됐다.   특히 코로나19 피해기업 특례보증 실적은 지난 6월 기준 4만7천141건, 1조1천662억원으로 전국 16개 시·도별 지역신보 중 1위를 차지했다. 전체 직원 90여 명인 경북신보가 760명인 서울신보보다 더 많은 실적을 기록한 것이다.   ◆폭발적인 실적 향상은   금융 전문가인 박진우 이사장을 비롯한 전 직원들이 소명 의식을 갖고 헌신적으로 노력한 결과란 평가다. 박 이사장은 신협중앙회장을 연임했다.   박 이사장은 2018년 취임 무렵 직원들과 약속했다. 직원들은 보증 지원과 부실채권관리 등 본연의 의무에 최선을, 이사장은 보증재원으로 활용되는 출연금 확보에 최선을 다하기로 했다. 박 이사장은 그 약속을 지켰다.   먼저 입법기관에 지속적인 건의를 통해 지역신보에 대한 출연 규정을 대폭 상향했다. 이에 매년 40억~50억원이던 금융회사 법정출연금은 90억~100억원으로 증가했다.   또 지자체·금융회사와 꾸준한 협력을 이끌어 내며 출연금 확보에 최선을 다해 2017년 105억이던 출연금을 올해는 356억원으로 세 배 이상 늘렸다.   경북 시·군 출연금은 2017년 시·군 4곳에 불과했으나 지금은 군위를 제외한 22개 시·군으로부터 출연금을 확보, 올해 소상공인들에게 1천678억원의 출연 특례보증을 지원했다.   ◆[박스]박진우 경북신용보증재단 이사장 인터뷰   코로나19 속에 시·군 영업점이 연일 보증 신청 고객들로 붐벼 직원 안전이 우려됐지만 직원 중 확진자가 발생하지 않아 무척 다행스럽고 감사하다. 비상경제 상황 속에서 경북의 소상공인들을 위해 헌신한 직원들의 노고에 존경과 감사를 전한다.   코로나19로 인한 비대면 서비스는 거스를 수 없는 큰 흐름이 되었고 재단도 비대면 보증지원 시스템 구축 등 포스트 코로나 시대를 준비 중이다.   그동안 출연금을 많이 확보했지만 그래도 재단의 현안은 안정적인 보증 공급을 위한 보증재원 마련이다. 출연금 확충이 절실한 것이다.   특히 내년은 코로나19 재확산에다 금융권의 리스크 관리에 따른 여신 심사 강화 등으로 소상공인 자금난이 더욱 악화될 전망이어서 정부 출연이 반드시 필요하다.   더불어 재단의 인력 확충도 시급하다. 현재 재단의 정식 직원은 80여 명으로, 보증 잔액 2조6천억원에 비하면 턱없이 부족하다. 직원들의 노력에도 불구, 고객 불편과 불만이 초래되는건 인력 부족 때문이다. 보증 규모에 맞게 인력을 충원해야 고객 서비스의 질을 높일 수 있다.   또 영업본부, 칠곡지점, 소상공인지원센터 등을 설립하지 못한 점이 아쉽다. 특히 23만 경북 소상공인들을 위한 지원센터는 경북도의 예산까지 지원받았으나 결국 무산돼 아쉬움이 크다.   최근 사업 실패로 부도난 소상공인들의 재기를 지원하는 방안을 적극 마련 중이다. 포항 지진 피해 때 지역신용보증재단 최초로 정부 예산을 확보, 경영 애로를 겪는 포항의 중소기업·소상공인 2천905곳에 1천41억원을 특례보증 지원한 것이 기억에 남는다.   경북 중소기업·소상공인의 경쟁력 강화 방안을 끊임없이 연구해 신뢰받는 동반자가 될 수 있도록 소임을 다하겠다."
12,경북 울진에 생활불편 해결사가 떴다!,01.Dec.20,https://news.imaeil.com/Society/2020120111015447987,매일신문,생활민원기동처리반 호응,"경북 울진의 각종 생활 불편을 해결해 주는 '생활민원기동처리반'(이하 처리반)이 군민들의 큰 호응을 얻고 있다.   처리반은 지난 2018년 9월부터 시작돼 저소득층, 노인, 장애인 등 사회취약계층을 대상으로 전등, 수도꼭지, 문손잡이, 방충망 교체 등 생활 속 작은 불편을 직접 찾아가 해결해주고 있다.   처리반은 올들어 11월 말 현재 3천498건의 생활불편 사항을 해결했다. 지난해 2천164건보다 1천344건 이상 처리건수가 늘었다.   특히 올해는 남울진민원센터 개소와 함께 기술인력 2명을 추가 채용해 총 4명이 2개의 생활민원기동처리반(북부, 남부)을 운영, 신속한 서비스를 제공하고 있다.   홀몸노인 A 씨는 ""고장난 전등을 교체하려고 의자 위에 올라가다가 어지러워서 손도 못 댄 적이 한 두번이 아니었는데, 생활민원기동처리반이 와서 다 해결해줘 멀리 있는 아들보다 낫다""며 고마움을 표했다.   전찬걸 울진군수는 ""코로나19로 연일 힘들어하는 군민들에게 찾아가는 생활밀착 복지서비스를 통해 군민들이 웃으며 만족하는 친절 울진이 되도록 최선을 다하겠다""고 말했다."
